{
  "schema_version": "1.0",
  "parameters": {
    "id": "spacecraft",
    "name": "轻型穿梭机",
    "en": "SHUTTLE",
    "radius": 2.1,
    "seat": [
      0,
      1.3,
      0.1
    ],
    "archetype": "spacecraft",
    "spaceFlight": {
      "hull": "box"
    },
    "envelope": {
      "kind": "box",
      "halfExtents": [
        2.1,
        1.5,
        3.8
      ],
      "offset": [
        0,
        1.2,
        0
      ]
    }
  },
  "runtime_contract": "external",
  "runtime_requirements": [
    {
      "runtime_id": "@worldkit/three",
      "contract": "whitebox.content-facts@1.0"
    }
  ]
}
