{
  "schema_version": "1.0",
  "parameters": {
    "id": "ski",
    "name": "双板滑雪",
    "en": "ALPINE",
    "archetype": "ski",
    "radius": 1.1,
    "seat": [
      0,
      0.91,
      0
    ],
    "envelope": {
      "kind": "box",
      "halfExtents": [
        0.65,
        0.9,
        1.05
      ],
      "offset": [
        0,
        0.9,
        0
      ]
    }
  },
  "runtime_contract": "external",
  "runtime_requirements": [
    {
      "runtime_id": "@worldkit/three",
      "contract": "whitebox.content-facts@1.0"
    }
  ]
}
