{
  "schema_version": "1.0",
  "parameters": {
    "id": "bus",
    "name": "复古小巴",
    "en": "MINIBUS",
    "archetype": "bus",
    "wheelbaseMeters": 3.3,
    "rearAxleZMeters": -1.45,
    "radius": 2.15,
    "seat": [
      0.47,
      1.13,
      1.38
    ],
    "wheelPhysics": {
      "chassis": {
        "kind": "box",
        "halfExtents": [
          1.14,
          1.21,
          2.96
        ],
        "offset": [
          0,
          1.44,
          0
        ]
      },
      "radius": 0.46,
      "halfTrack": 1.035,
      "halfWheelbase": 1.65,
      "hubHeight": 0.46,
      "wheelWidth": 0.22,
      "wheels": [
        {
          "x": -1.035,
          "z": -1.45,
          "steering": false,
          "driven": true
        },
        {
          "x": -1.035,
          "z": 1.85,
          "steering": true,
          "driven": false
        },
        {
          "x": 1.035,
          "z": -1.45,
          "steering": false,
          "driven": true
        },
        {
          "x": 1.035,
          "z": 1.85,
          "steering": true,
          "driven": false
        }
      ]
    },
    "envelope": {
      "kind": "box",
      "halfExtents": [
        1.22,
        1.34,
        2.96
      ],
      "offset": [
        0,
        1.34,
        0
      ]
    }
  },
  "runtime_contract": "external",
  "runtime_requirements": [
    {
      "runtime_id": "@worldkit/three",
      "contract": "whitebox.content-facts@1.0"
    }
  ]
}
