{
  "schema_version": "1.0",
  "parameters": {
    "id": "rover",
    "name": "越野车",
    "en": "ROVER",
    "radius": 1.65,
    "seat": [
      0,
      1.108,
      0
    ],
    "archetype": "rover",
    "envelope": {
      "kind": "box",
      "halfExtents": [
        1.35,
        0.9899999999999999,
        2.15
      ],
      "offset": [
        0,
        1.3099999999999998,
        0
      ]
    },
    "wheelPhysics": {
      "radius": 0.52,
      "hubHeight": 0.52,
      "halfTrack": 1.1,
      "halfWheelbase": 1.27,
      "wheelWidth": 0.4,
      "wheels": [
        {
          "x": -1.1,
          "z": -1.27,
          "steering": false,
          "driven": true
        },
        {
          "x": -1.1,
          "z": 1.27,
          "steering": true,
          "driven": true
        },
        {
          "x": 1.1,
          "z": -1.27,
          "steering": false,
          "driven": true
        },
        {
          "x": 1.1,
          "z": 1.27,
          "steering": true,
          "driven": true
        }
      ],
      "bodyParts": [
        {
          "kind": "box",
          "halfExtents": [
            1,
            0.125,
            1.9
          ],
          "offset": [
            0,
            0.605,
            0
          ]
        },
        {
          "kind": "box",
          "halfExtents": [
            1,
            0.2,
            0.9
          ],
          "offset": [
            0,
            0.88,
            0
          ]
        },
        {
          "kind": "box",
          "halfExtents": [
            1.1,
            0.1,
            0.09
          ],
          "offset": [
            0,
            0.5,
            2
          ]
        },
        {
          "kind": "box",
          "halfExtents": [
            1.1,
            0.1,
            0.09
          ],
          "offset": [
            0,
            0.5,
            -2
          ]
        },
        {
          "kind": "box",
          "halfExtents": [
            0.9,
            0.125,
            0.65
          ],
          "offset": [
            0,
            1.22,
            1.1
          ]
        },
        {
          "kind": "box",
          "halfExtents": [
            0.95,
            0.09,
            0.4
          ],
          "offset": [
            0,
            1.27,
            -1.25
          ]
        },
        {
          "kind": "box",
          "halfExtents": [
            0.99,
            0.605,
            0.96
          ],
          "offset": [
            0,
            1.625,
            0.1
          ]
        },
        {
          "kind": "box",
          "halfExtents": [
            0.88,
            0.09,
            0.035
          ],
          "offset": [
            0,
            0.85,
            1.94
          ]
        },
        {
          "kind": "box",
          "halfExtents": [
            0.81,
            0.07,
            0.03
          ],
          "offset": [
            0,
            0.8,
            -1.94
          ]
        }
      ]
    }
  },
  "runtime_contract": "external",
  "runtime_requirements": [
    {
      "runtime_id": "@worldkit/three",
      "contract": "whitebox.content-facts@1.0"
    }
  ]
}
