{
  "schema_version": "1.0",
  "parameters": {
    "id": "boat",
    "name": "水上快艇",
    "en": "WAKE",
    "radius": 1.7,
    "seat": [
      0,
      0.35,
      -0.3
    ],
    "archetype": "boat",
    "envelope": {
      "kind": "box",
      "halfExtents": [
        1.35,
        1.25,
        2.85
      ],
      "offset": [
        0,
        0.5,
        0
      ]
    }
  },
  "runtime_contract": "external",
  "runtime_requirements": [
    {
      "runtime_id": "@worldkit/three",
      "contract": "whitebox.content-facts@1.0"
    }
  ]
}
