{
  "schema_version": "1.0",
  "parameters": {
    "id": "helicopter",
    "name": "单主旋翼直升机",
    "en": "HELI",
    "radius": 2,
    "seat": [
      0,
      1.3,
      0.1
    ],
    "archetype": "plane",
    "envelope": {
      "kind": "box",
      "halfExtents": [
        4.5,
        1.4,
        4.1
      ],
      "offset": [
        0,
        1.4,
        0
      ]
    }
  },
  "runtime_contract": "external",
  "runtime_requirements": [
    {
      "runtime_id": "@worldkit/three",
      "contract": "whitebox.content-facts@1.0"
    }
  ]
}
