{
  "schema_version": "1.0",
  "parameters": {
    "id": "canoe",
    "name": "单桨木舟",
    "en": "CANOE",
    "archetype": "canoe",
    "radius": 0.7,
    "seat": [
      0,
      0.45,
      -0.45
    ],
    "bodyPhysics": {
      "water": {
        "depth": 0.48,
        "bottom": 0.32
      }
    },
    "envelope": {
      "kind": "box",
      "halfExtents": [
        0.6,
        0.34,
        2.4
      ],
      "offset": [
        0,
        0.1,
        0
      ]
    }
  },
  "runtime_contract": "external",
  "runtime_requirements": [
    {
      "runtime_id": "@worldkit/three",
      "contract": "whitebox.content-facts@1.0"
    }
  ]
}
